{
  "schema_version": "2.0.0",
  "project": {
    "name": "",
    "repo_root": ".",
    "primary_stack": []
  },
  "status": {
    "phase": "initialized",
    "last_updated": "0000-00-00T00:00:00Z",
    "last_command": "",
    "active_environment": "local"
  },
  "counts": {
    "domains": 0,
    "flows": 0,
    "issues": 0,
    "critical_issues": 0,
    "high_issues": 0,
    "evidence_artifacts": 0,
    "council_sessions": 0
  },
  "confidence": {
    "overall": "unknown",
    "highest_risk_domains": [],
    "stale_domains": []
  },
  "next_recommended_commands": []
}
